{
  "id": "long_term_care_central",
  "name": "長期照顧服務（長照 2.0）",
  "category": "long_term_care",
  "jurisdiction": "central",
  "area": { "type": "nationwide" },
  "status": "needs_review",
  "version": "2026.06",
  "eligibility_rules": {
    "all": [
      { "field": "care_need", "operator": "equals", "value": true }
    ]
  },
  "required_documents": [
    { "name": "身分證明文件", "condition": "always" },
    { "name": "失能或診斷證明", "condition": { "field": "care_need", "operator": "equals", "value": true } }
  ],
  "conflicts": [],
  "source": {
    "title": "衛福部長照專區（1966）- 申請長照服務",
    "url": "https://1966.gov.tw/LTC/cp-6533-70777-207.html",
    "last_checked_at": "2026-06-26"
  }
}
